{
  "schema_version": 1,
  "strategy_version": 1,
  "candidate": {
    "career_profile_path": "profile/career.yml",
    "current_direction": "Prioritize software engineering roles, especially hands-on AI engineering, applied AI, AI agents, automation, backend systems, and AI-enabled products."
  },
  "search_strategy": {
    "primary_targets": [
      {
        "title": "AI Engineer",
        "priority_score": 100,
        "reasons": [
          "Directly aligned with the intended career direction",
          "Uses AI application development and software engineering",
          "Strong portfolio alignment with the AI Job Search Agent project"
        ]
      },
      {
        "title": "Applied AI Engineer",
        "priority_score": 100,
        "reasons": [
          "Focuses on building usable AI systems",
          "Matches experience with LLM workflows, APIs, automation, and product development"
        ]
      },
      {
        "title": "Software Engineer, AI",
        "priority_score": 98,
        "reasons": [
          "Combines established software engineering experience with current AI development"
        ]
      },
      {
        "title": "AI Application Engineer",
        "priority_score": 98,
        "reasons": [
          "Emphasizes production AI applications rather than pure research"
        ]
      },
      {
        "title": "AI Agent Engineer",
        "priority_score": 97,
        "reasons": [
          "Directly aligned with agent architecture and workflow orchestration work"
        ]
      },
      {
        "title": "Generative AI Engineer",
        "priority_score": 96,
        "reasons": [
          "Aligns with LLM integration, prompt systems, validation, and AI product development"
        ]
      },
      {
        "title": "AI Automation Engineer",
        "priority_score": 95,
        "reasons": [
          "Strong alignment with workflow automation and deterministic AI-assisted systems"
        ]
      },
      {
        "title": "Full-Stack Engineer, AI Products",
        "priority_score": 94,
        "reasons": [
          "Uses prior full-stack experience while supporting the move into AI engineering"
        ]
      },
      {
        "title": "Backend Engineer, AI Platform",
        "priority_score": 93,
        "reasons": [
          "Aligns with APIs, Python, integrations, data flows, Docker, and backend systems"
        ]
      },
      {
        "title": "Software Engineer",
        "priority_score": 90,
        "reasons": [
          "Strong general fit when the role includes backend, platform, automation, data, or AI-related work"
        ]
      }
    ],
    "secondary_targets": [
      {
        "title": "Machine Learning Engineer",
        "priority_score": 87,
        "reasons": [
          "Relevant when focused on applied systems, deployment, pipelines, or product integration rather than advanced model research"
        ]
      },
      {
        "title": "AI Solutions Engineer",
        "priority_score": 86,
        "reasons": [
          "Relevant when the role is hands-on and engineering-led rather than primarily sales or demonstrations"
        ]
      },
      {
        "title": "Analytics Engineer",
        "priority_score": 84,
        "reasons": [
          "Uses SQL, Python, data modelling, analytics, and engineering practices"
        ]
      },
      {
        "title": "Data Engineer",
        "priority_score": 82,
        "reasons": [
          "Relevant when experience requirements are achievable and work includes Python, SQL, APIs, or pipelines"
        ]
      },
      {
        "title": "Data Solutions Analyst",
        "priority_score": 76,
        "reasons": [
          "Acceptable analytics path with technical ownership and limited customer-facing work"
        ]
      },
      {
        "title": "Business Systems Analyst",
        "priority_score": 68,
        "reasons": [
          "Uses existing systems and business analysis experience but is no longer a primary direction"
        ]
      }
    ],
    "conditional_targets": [
      {
        "title": "Technical AI Consultant",
        "priority_score": 82,
        "conditions": [
          "At least half of the role involves hands-on implementation",
          "The role is not primarily account management or sales",
          "The role includes building, integrating, or deploying AI systems"
        ]
      },
      {
        "title": "Solutions Engineer",
        "priority_score": 72,
        "conditions": [
          "The position includes meaningful coding or implementation ownership",
          "The position is not primarily pre-sales",
          "Customer-facing work is secondary to technical delivery"
        ]
      },
      {
        "title": "Implementation Engineer",
        "priority_score": 70,
        "conditions": [
          "The role includes software integration, APIs, automation, scripting, or technical configuration",
          "The role is not primarily support or onboarding"
        ]
      },
      {
        "title": "Product Engineer",
        "priority_score": 88,
        "conditions": [
          "The role includes substantial software development",
          "The product is technical, data-driven, or AI-enabled"
        ]
      }
    ],
    "excluded_titles": [
      "Account Executive",
      "Account Manager",
      "Business Development Representative",
      "Customer Success Manager",
      "Customer Service Representative",
      "Employment Counsellor",
      "Executive Assistant",
      "Marketing Coordinator",
      "Office Administrator",
      "Recruiter",
      "Sales Development Representative",
      "Social Media Coordinator"
    ]
  },
  "locations": {
    "home_region": "Richmond, British Columbia, Canada",
    "preferred": [
      "Remote within Canada",
      "Richmond, British Columbia",
      "Vancouver, British Columbia",
      "Burnaby, British Columbia",
      "Lower Mainland, British Columbia"
    ],
    "acceptable": [
      "Hybrid within the Lower Mainland",
      "Remote-first Canadian company",
      "Occasional office attendance within Metro Vancouver"
    ],
    "excluded": [
      "Mandatory relocation outside British Columbia",
      "Daily on-site attendance outside the Lower Mainland"
    ],
    "remote_rules": {
      "canada_remote": "preferred",
      "us_remote": "acceptable_if_canadian_hiring_supported"
    }
  },
  "employment": {
    "preferred_types": [
      "Full-time permanent"
    ],
    "acceptable_types": [
      "Full-time contract",
      "Temporary full-time",
      "Fixed-term contract"
    ],
    "excluded_types": [
      "Commission only",
      "Unpaid",
      "Volunteer",
      "Part-time under 25 hours per week"
    ],
    "preferred_seniority": [
      "Intermediate",
      "Mid-level",
      "Senior when requirements are achievable"
    ],
    "acceptable_seniority": [
      "Junior when the role provides meaningful AI engineering experience",
      "Lead when the role values broad delivery experience over narrow years-of-title requirements"
    ]
  },
  "company_preferences": {
    "preferred": [
      {
        "name": "AI product companies",
        "score": 100
      },
      {
        "name": "Developer tools",
        "score": 96
      },
      {
        "name": "B2B SaaS",
        "score": 94
      },
      {
        "name": "Workflow automation",
        "score": 94
      },
      {
        "name": "Data and analytics platforms",
        "score": 90
      },
      {
        "name": "Productivity software",
        "score": 88
      },
      {
        "name": "Applied AI startups",
        "score": 96
      }
    ],
    "acceptable": [
      {
        "name": "Enterprise software",
        "score": 82
      },
      {
        "name": "Cleantech",
        "score": 80
      },
      {
        "name": "Fintech",
        "score": 80
      },
      {
        "name": "Insurtech",
        "score": 78
      },
      {
        "name": "Public sector technology",
        "score": 72
      }
    ],
    "lower_priority": [
      {
        "name": "General consulting",
        "score": 60
      },
      {
        "name": "Digital agencies",
        "score": 55
      },
      {
        "name": "Non-technical service companies",
        "score": 45
      }
    ],
    "excluded": [
      "Commission-driven sales organizations",
      "Multi-level marketing",
      "Unpaid startup roles",
      "Organizations requiring employees to purchase products or leads"
    ]
  },
  "technical_focus": {
    "high_priority": [
      {
        "name": "AI agents",
        "score": 100
      },
      {
        "name": "LLM application development",
        "score": 100
      },
      {
        "name": "Python",
        "score": 98
      },
      {
        "name": "API development and integration",
        "score": 96
      },
      {
        "name": "Workflow automation",
        "score": 96
      },
      {
        "name": "Backend systems",
        "score": 92
      },
      {
        "name": "AI-enabled product development",
        "score": 96
      },
      {
        "name": "Structured outputs and validation",
        "score": 92
      },
      {
        "name": "Docker",
        "score": 88
      }
    ],
    "medium_priority": [
      {
        "name": "SQL",
        "score": 85
      },
      {
        "name": "Data pipelines",
        "score": 82
      },
      {
        "name": "Cloud platforms",
        "score": 76
      },
      {
        "name": "Full-stack development",
        "score": 82
      },
      {
        "name": "Analytics engineering",
        "score": 78
      },
      {
        "name": "Browser automation",
        "score": 82
      },
      {
        "name": "DevOps and deployment",
        "score": 75
      }
    ],
    "low_priority": [
      {
        "name": "Pure visual design",
        "score": 35
      },
      {
        "name": "CMS-only development",
        "score": 30
      },